What is the capital of France?;Paris;London;Berlin;Madrid;Paris;https://cdn.kroati.de/images/uploads/reisefuehrer/kroatien/norddalmatien/kraj/kraj_insel-pasman_kroatien.jpg
What is the capital of Germany?;Vienna;Berlin;Rome;Madrid;Berlin;https://image.novasol.com/pic/1024/cdu/201906121506/cdu452_main_02.jpg
What is the capital of Spain?;Lisbon;Madrid;Paris;Rome;Madrid;https://www.tapeciarnia.pl/tapety/normalne/256940_jezioro_gory_lasy_krajobraz.jpg
What is the capital of Italy?;Rome;Berlin;Paris;Madrid;Rome
What are the primary colors?;Red;Green;Blue;Yellow;Red,Blue,Yellow;https://example.com/primary_colors.jpg
Which of the following are mammals?;Elephant;Shark;Dog;Eagle;Elephant,Dog;https://th.bing.com/th/id/OIP.z86nurg5VEy9ULrYNyQu0wHaE5?w=301&h=199&c=7&r=0&o=5&pid=1.7

